{
  "schemaVersion": 2,
  "reviewedAt": "2026-09-08",
  "title": "Explore · Mech",
  "framework": {
    "title": "Technical Dimensions of Programming Systems",
    "authors": [
      "Joel Jakubovic",
      "Jonathan Edwards",
      "Tomas Petricek"
    ],
    "year": 2023,
    "sources": [
      "paper",
      "catalogue"
    ],
    "catalogueDimensionCount": 23,
    "comparisonTopicCount": 21,
    "groupingNote": "This page retains 21 grouped topics from the earlier Mech treatment. The authors’ catalogue describes 23 dimensions; compound headings, including surface/internal notation and addressing/externalizability, remain grouped here. These are comparison topics, not a renumbered edition of the paper."
  },
  "methodology": {
    "kind": "Qualitative editorial comparison",
    "review": "Primary documentation reviewed 2026-09-08; software was not benchmarked or independently qualified in this comparison.",
    "scope": "Profiles name the environment as well as the language. Library-specific capabilities are not silently promoted to language defaults.",
    "interpretation": "Labels, tradeoffs, and Mech design implications are editorial assessments based on the linked sources, not ratings by the original paper’s authors or endorsements by the systems’ maintainers.",
    "missing": "A missing assessment means not yet assessed, never no capability.",
    "mech": "The Mech profile combines documented language behavior and v0.4 architectural design. Proposed work is kept in the separate Mech design notes."
  },
  "defaults": {
    "systems": [
      "mech",
      "julia",
      "matlab",
      "rust"
    ],
    "cluster": "interaction"
  },
  "clusters": [
    {
      "id": "interaction",
      "number": "01",
      "title": "Interaction",
      "summary": "The path from an idea to its consequences.",
      "question": "How do we edit, run, inspect, and make abstractions?"
    },
    {
      "id": "notation",
      "number": "02",
      "title": "Notation",
      "summary": "The representations we use to think and program.",
      "question": "How do code, documents, visual tools, and internal structures relate?"
    },
    {
      "id": "structure",
      "number": "03",
      "title": "Conceptual structure",
      "summary": "The concepts a system is built around.",
      "question": "How do the parts fit together, and where are the boundaries?"
    },
    {
      "id": "customizability",
      "number": "04",
      "title": "Customizability",
      "summary": "How an existing system can be changed.",
      "question": "What can be changed, from where, and at what stage?"
    },
    {
      "id": "complexity",
      "number": "05",
      "title": "Complexity",
      "summary": "The work divided between programmer and system.",
      "question": "Which details are packaged, inferred, or left explicit?"
    },
    {
      "id": "errors",
      "number": "06",
      "title": "Errors",
      "summary": "Detecting problems and responding to them.",
      "question": "When do we learn something is wrong, and what happens next?"
    },
    {
      "id": "adoptability",
      "number": "07",
      "title": "Adoptability",
      "summary": "The path into a system, and the community around it.",
      "question": "What makes a system learnable, shareable, and practical to adopt?"
    }
  ],
  "dimensions": [
    {
      "id": "feedback",
      "icon": "rotate-cw",
      "color": "--mech-accent-coral",
      "cluster": "interaction",
      "number": "01.1",
      "title": "Feedback loops",
      "definition": "The loop between an action and an observable consequence.",
      "question": "After a change, what must you do to see and understand its consequences?",
      "related": [
        "detection",
        "surface",
        "learnability"
      ],
      "sources": [
        "catalogue"
      ],
      "mechTreatment": {
        "takeaway": "Make consequences visible, not merely fast.",
        "position": "A useful Mech loop connects an idea, an edit, validation, an accepted update, and the visible consequence. Kernel throughput alone does not tell us how difficult that loop is to complete.",
        "proposal": "Treat edit-to-visible-result latency and the work needed to expose relevant values as first-class evaluation measures. Keep the same result identity across the document, transcript, and inspector.",
        "tension": "More observation can consume rendering time, retained state, and memory. Fast automatic updates are not helpful when the result the programmer needs is still hidden.",
        "evidence": "The interactive architecture specifies stable output identity, coordinated diagnostics, and consistent epochs across results and inspection. This is an architectural foundation, not an end-to-end usability measurement.",
        "status": "architecture",
        "refs": [
          "interactive"
        ],
        "example": "Change the EKF measurement-noise parameter. Inspect the estimate, covariance, and relevant intermediate values without writing a separate debugging application.",
        "tests": [
          "Measure editing, checking, activation, execution, and rendering separately.",
          "Count the actions needed to reveal the relevant intermediate result.",
          "Verify that displayed values identify the accepted version that produced them."
        ]
      }
    },
    {
      "id": "modes",
      "icon": "mouse-pointer-click",
      "color": "--mech-accent-coral",
      "cluster": "interaction",
      "number": "01.2",
      "title": "Modes of interaction",
      "definition": "The stages that enable or restrict different interactions.",
      "question": "Which actions are available while editing, inspecting, and running?",
      "related": [
        "staging",
        "integrity",
        "sociability"
      ],
      "sources": [
        "catalogue"
      ],
      "mechTreatment": {
        "takeaway": "Unify meaning without erasing useful boundaries.",
        "position": "An interactive document, an embedded runtime, and a packaged native application can share computational meaning without sharing every tool or permission.",
        "proposal": "Keep semantic behavior consistent across modes. Make available actions explicit: an author may replace a computation, while a deployed operator may only adjust approved inputs.",
        "tension": "Collapsing every mode into unrestricted live editing conflicts with authorization, lifecycle control, and predictable operation. Different permissions need not imply different semantics.",
        "evidence": "The shared resident session places frontends behind adapters. The native design deliberately omits source parsing and compilation from generated applications.",
        "status": "architecture",
        "refs": [
          "interactive",
          "native"
        ],
        "example": "Read the estimator in a document, inspect it in a resident session, and then load it into a Rust host. The algorithm should not need three definitions.",
        "tests": [
          "Identify which actions are available in each mode.",
          "Compare outputs for the same inputs across supported execution paths.",
          "Verify that restricted modes cannot acquire authoring privileges implicitly."
        ]
      }
    },
    {
      "id": "abstraction",
      "icon": "shapes",
      "color": "--mech-accent-coral",
      "cluster": "interaction",
      "number": "01.3",
      "title": "Abstraction construction",
      "definition": "The path from concrete cases to reusable descriptions.",
      "question": "How do you turn a working example into a reusable component?",
      "related": [
        "composability",
        "feedback",
        "automation"
      ],
      "sources": [
        "catalogue"
      ],
      "mechTreatment": {
        "takeaway": "Making a model reusable should not make it invisible.",
        "position": "A concrete estimator document exposes intermediate calculations. Turning it into a function or component should not automatically remove that visibility. Functions alone are not an example-to-abstraction workflow.",
        "proposal": "Explore extraction that suggests inputs, persistent state, assumptions, and outputs from dependencies and inferred types. Preserve inspectable intermediate values for individual invocations.",
        "tension": "Abstraction reduces repetition, but can hide the details that made an example understandable. Automatic extraction also needs a deliberate decision about state and effects.",
        "evidence": "Mech documents functions and other composition mechanisms. Guided extraction with retained invocation-level observability is a proposal in this analysis, not a verified feature.",
        "status": "proposal",
        "refs": [
          "readme"
        ],
        "example": "Extract the EKF into a reusable estimator, create two independent instances, and inspect the predicted covariance inside each invocation.",
        "tests": [
          "Record which manual decisions extraction requires.",
          "Verify that two instances do not accidentally share mutable state.",
          "Compare access to intermediate values before and after extraction."
        ]
      }
    },
    {
      "id": "notational-structure",
      "icon": "code-xml",
      "color": "--mech-accent-purple",
      "cluster": "notation",
      "number": "02.1",
      "title": "Notational structure",
      "definition": "The relationship between the notations used together.",
      "question": "What notations are used to program the system and how are they related?",
      "related": [
        "surface",
        "primary",
        "uniformity"
      ],
      "sources": [
        "catalogue"
      ],
      "mechTreatment": {
        "takeaway": "Every editable view needs to say what it edits.",